UNC Hospitals,,,
1070999 - UNC HOSPITALS,826,MYELOPROLIF DISORD OR POORLY DIFF NEOPL W MAJ O.R. PROC W MCC," 169,845 "
1070999 - UNC HOSPITALS,827,MYELOPROLIF DISORD OR POORLY DIFF NEOPL W MAJ O.R. PROC W CC," 59,560 "
1070999 - UNC HOSPITALS,828,MYELOPROLIF DISORD OR POORLY DIFF NEOPL W MAJ O.R. PROC W-O CC-MCC," 40,083 "
1070999 - UNC HOSPITALS,829,MYELOPROLIFERATIVE DISORDERS OR POORLY DIFFERENTIATED NEOPLASMS W OTHER  PROCEDURE W CC-MCC," 86,941 "
1070999 - UNC HOSPITALS,830,MYELOPROLIFERATIVE DISORDERS OR POORLY DIFFERENTIATED NEOPLASMS W OTHER  PROCEDURE W-O CC-MCC," 38,208 "
1070999 - UNC HOSPITALS,834,ACUTE LEUKEMIA W-O MAJOR O.R. PROCEDURE W MCC," 221,278 "
1070999 - UNC HOSPITALS,835,ACUTE LEUKEMIA W-O MAJOR O.R. PROCEDURE W CC," 95,446 "
1070999 - UNC HOSPITALS,836,ACUTE LEUKEMIA W-O MAJOR O.R. PROCEDURE W-O CC-MCC," 56,716 "
1070999 - UNC HOSPITALS,837,CHEMO W ACUTE LEUKEMIA AS SDX OR W HIGH DOSE CHEMO AGENT W MCC," 115,536 "
1070999 - UNC HOSPITALS,838,CHEMO W ACUTE LEUKEMIA AS SDX W CC OR HIGH DOSE CHEMO AGENT," 45,600 "
1070999 - UNC HOSPITALS,839,CHEMO W ACUTE LEUKEMIA AS SDX W-O CC-MCC," 27,901 "
1070999 - UNC HOSPITALS,840,LYMPHOMA AND NON-ACUTE LEUKEMIA W MCC," 132,547 "
1070999 - UNC HOSPITALS,841,LYMPHOMA AND NON-ACUTE LEUKEMIA W CC," 47,496 "
1070999 - UNC HOSPITALS,842,LYMPHOMA AND NON-ACUTE LEUKEMIA W-O CC-MCC," 41,764 "
1070999 - UNC HOSPITALS,843,OTHER MYELOPROLIF DIS OR POORLY DIFF NEOPL DIAG W MCC," 50,523 "
1070999 - UNC HOSPITALS,844,OTHER MYELOPROLIF DIS OR POORLY DIFF NEOPL DIAG W CC," 32,289 "
1070999 - UNC HOSPITALS,845,OTHER MYELOPROLIF DIS OR POORLY DIFF NEOPL DIAG W-O CC-MCC," 47,929 "
1070999 - UNC HOSPITALS,846,CHEMOTHERAPY W-O ACUTE LEUKEMIA AS SECONDARY DIAGNOSIS W MCC," 81,582 "
1070999 - UNC HOSPITALS,847,CHEMOTHERAPY W-O ACUTE LEUKEMIA AS SECONDARY DIAGNOSIS W CC," 26,553 "
1070999 - UNC HOSPITALS,848,CHEMOTHERAPY W-O ACUTE LEUKEMIA AS SECONDARY DIAGNOSIS W-O CC-MCC," 19,370 "
1070999 - UNC HOSPITALS,853,INFECTIOUS AND PARASITIC DISEASES W O.R. PROCEDURE W MCC," 167,658 "
1070999 - UNC HOSPITALS,854,INFECTIOUS AND PARASITIC DISEASES W O.R. PROCEDURE W CC," 73,531 "
1070999 - UNC HOSPITALS,855,INFECTIOUS AND PARASITIC DISEASES W O.R. PROCEDURE W-O CC-MCC," 29,649 "
1070999 - UNC HOSPITALS,856,POSTOPERATIVE OR POST-TRAUMATIC INFECTIONS W O.R. PROC W MCC," 107,383 "
1070999 - UNC HOSPITALS,857,POSTOPERATIVE OR POST-TRAUMATIC INFECTIONS W O.R. PROC W CC," 43,480 "
1070999 - UNC HOSPITALS,858,POSTOPERATIVE OR POST-TRAUMATIC INFECTIONS W O.R. PROC W-O CC-MCC," 36,534 "
1070999 - UNC HOSPITALS,862,POSTOPERATIVE AND POST-TRAUMATIC INFECTIONS W MCC," 45,011 "
1070999 - UNC HOSPITALS,863,POSTOPERATIVE AND POST-TRAUMATIC INFECTIONS W-O MCC," 23,476 "
1070999 - UNC HOSPITALS,864,FEVER," 22,028 "
1070999 - UNC HOSPITALS,865,VIRAL ILLNESS W MCC," 98,612 "
1070999 - UNC HOSPITALS,866,VIRAL ILLNESS W-O MCC," 14,859 "
1070999 - UNC HOSPITALS,867,OTHER INFECTIOUS AND PARASITIC DISEASES DIAGNOSES W MCC," 42,801 "
1070999 - UNC HOSPITALS,868,OTHER INFECTIOUS AND PARASITIC DISEASES DIAGNOSES W CC," 29,142 "
1070999 - UNC HOSPITALS,869,OTHER INFECTIOUS AND PARASITIC DISEASES DIAGNOSES W-O CC-MCC," 17,716 "
1070999 - UNC HOSPITALS,870,SEPTICEMIA OR SEVERE SEPSIS W MV GREATER THAN 96 HOURS," 185,218 "
1070999 - UNC HOSPITALS,871,SEPTICEMIA OR SEVERE SEPSIS W-O MV GREATER THAN 96 HOURS W MCC," 53,433 "
1070999 - UNC HOSPITALS,872,SEPTICEMIA OR SEVERE SEPSIS W-O MV GREATER THAN 96 HOURS W-O MCC," 26,450 "
1070999 - UNC HOSPITALS,876,O.R. PROCEDURE W PRINCIPAL DIAGNOSES OF MENTAL ILLNESS," 39,840 "
1070999 - UNC HOSPITALS,880,ACUTE ADJUSTMENT REACTION AND PSYCHOSOCIAL DYSFUNCTION," 24,139 "
1070999 - UNC HOSPITALS,881,DEPRESSIVE NEUROSES," 25,602 "
1070999 - UNC HOSPITALS,882,NEUROSES EXCEPT DEPRESSIVE," 27,502 "
1070999 - UNC HOSPITALS,883,DISORDERS OF PERSONALITY AND IMPULSE CONTROL," 51,706 "
1070999 - UNC HOSPITALS,884,ORGANIC DISTURBANCES AND INTELLECTUAL DISABILITY," 36,305 "
1070999 - UNC HOSPITALS,885,PSYCHOSES," 39,685 "
1070999 - UNC HOSPITALS,886,BEHAVIORAL AND DEVELOPMENTAL DISORDERS," 45,424 "
1070999 - UNC HOSPITALS,887,OTHER MENTAL DISORDER DIAGNOSES," 70,401 "
1070999 - UNC HOSPITALS,894,ALCOHOL-DRUG ABUSE OR DEPENDENCE LEFT AMA," 14,412 "
1070999 - UNC HOSPITALS,895,ALCOHOL-DRUG ABUSE OR DEPENDENCE W REHABILITATION THERAPY," 18,418 "
1070999 - UNC HOSPITALS,896,ALCOHOL-DRUG ABUSE OR DEPENDENCE W-O REHABILITATION THERAPY W MCC," 47,476 "
1070999 - UNC HOSPITALS,897,ALCOHOL-DRUG ABUSE OR DEPENDENCE W-O REHABILITATION THERAPY W-O MCC," 19,016 "
1070999 - UNC HOSPITALS,901,WOUND DEBRIDEMENTS FOR INJURIES W MCC," 90,502 "
1070999 - UNC HOSPITALS,902,WOUND DEBRIDEMENTS FOR INJURIES W CC," 55,205 "
1070999 - UNC HOSPITALS,903,WOUND DEBRIDEMENTS FOR INJURIES W-O CC-MCC," 28,749 "
1070999 - UNC HOSPITALS,904,SKIN GRAFTS FOR INJURIES W CC-MCC," 132,629 "
1070999 - UNC HOSPITALS,905,SKIN GRAFTS FOR INJURIES W-O CC-MCC," 35,620 "
1070999 - UNC HOSPITALS,906,HAND PROCEDURES FOR INJURIES," 55,067 "
1070999 - UNC HOSPITALS,907,OTHER O.R. PROCEDURES FOR INJURIES W MCC," 118,474 "
1070999 - UNC HOSPITALS,908,OTHER O.R. PROCEDURES FOR INJURIES W CC," 55,321 "
1070999 - UNC HOSPITALS,909,OTHER O.R. PROCEDURES FOR INJURIES W-O CC-MCC," 30,916 "
1070999 - UNC HOSPITALS,913,TRAUMATIC INJURY W MCC," 21,629 "
1070999 - UNC HOSPITALS,914,TRAUMATIC INJURY W-O MCC," 18,939 "
1070999 - UNC HOSPITALS,915,ALLERGIC REACTIONS W MCC," 21,359 "
1070999 - UNC HOSPITALS,916,ALLERGIC REACTIONS W-O MCC," 21,201 "
1070999 - UNC HOSPITALS,917,POISONING AND TOXIC EFFECTS OF DRUGS W MCC," 42,085 "
1070999 - UNC HOSPITALS,918,POISONING AND TOXIC EFFECTS OF DRUGS W-O MCC," 18,168 "
1070999 - UNC HOSPITALS,919,COMPLICATIONS OF TREATMENT W MCC," 70,441 "
1070999 - UNC HOSPITALS,920,COMPLICATIONS OF TREATMENT W CC," 24,646 "
1070999 - UNC HOSPITALS,921,COMPLICATIONS OF TREATMENT W-O CC-MCC," 14,818 "
1070999 - UNC HOSPITALS,922,OTHER INJURY POISONING AND TOXIC EFFECT DIAG W MCC," 54,477 "
1070999 - UNC HOSPITALS,923,OTHER INJURY POISONING AND TOXIC EFFECT DIAG W-O MCC," 17,637 "
1070999 - UNC HOSPITALS,927,EXTENSIVE BURNS OR FULL THICKNESS BURNS W MV GREATER THAN 96 HRS W SKIN GRAFT," 373,187 "
1070999 - UNC HOSPITALS,928,FULL THICKNESS BURN W SKIN GRAFT OR INHAL INJ W CC-MCC," 134,795 "
1070999 - UNC HOSPITALS,929,FULL THICKNESS BURN W SKIN GRAFT OR INHAL INJ W-O CC-MCC," 62,446 "
1070999 - UNC HOSPITALS,933,EXTENSIVE BURNS OR FULL THICKNESS BURNS W MV GREATER THAN 96 HRS W-O SKIN GRAFT," 83,162 "
1070999 - UNC HOSPITALS,934,FULL THICKNESS BURN W-O SKIN GRFT OR INHAL INJ," 37,717 "
1070999 - UNC HOSPITALS,935,NON-EXTENSIVE BURNS," 31,831 "
1070999 - UNC HOSPITALS,939,O.R. PROC W DIAGNOSES OF OTHER CONTACT W HEALTH SERVICES W MCC," 72,403 "
1070999 - UNC HOSPITALS,940,O.R. PROC W DIAGNOSES OF OTHER CONTACT W HEALTH SERVICES W CC," 60,750 "
1070999 - UNC HOSPITALS,941,O.R. PROC W DIAGNOSES OF OTHER CONTACT W HEALTH SERVICES W-O CC-MCC," 20,875 "
1070999 - UNC HOSPITALS,947,SIGNS AND SYMPTOMS W MCC," 36,816 "
1070999 - UNC HOSPITALS,948,SIGNS AND SYMPTOMS W-O MCC," 33,303 "
1070999 - UNC HOSPITALS,949,AFTERCARE W CC-MCC," 57,883 "
1070999 - UNC HOSPITALS,950,AFTERCARE W-O CC-MCC," 44,147 "
1070999 - UNC HOSPITALS,951,OTHER FACTORS INFLUENCING HEALTH STATUS," 20,724 "
1070999 - UNC HOSPITALS,955,CRANIOTOMY FOR MULTIPLE SIGNIFICANT TRAUMA," 179,436 "
1070999 - UNC HOSPITALS,956,LIMB REATTACHMENT HIP AND FEMUR PROC FOR MULTIPLE SIGNIFICANT TRAUMA," 157,581 "
1070999 - UNC HOSPITALS,957,OTHER O.R. PROCEDURES FOR MULTIPLE SIGNIFICANT TRAUMA W MCC," 166,666 "
1070999 - UNC HOSPITALS,958,OTHER O.R. PROCEDURES FOR MULTIPLE SIGNIFICANT TRAUMA W CC," 101,883 "
1070999 - UNC HOSPITALS,959,OTHER O.R. PROCEDURES FOR MULTIPLE SIGNIFICANT TRAUMA W-O CC-MCC," 57,483 "
1070999 - UNC HOSPITALS,963,OTHER MULTIPLE SIGNIFICANT TRAUMA W MCC," 70,760 "
1070999 - UNC HOSPITALS,964,OTHER MULTIPLE SIGNIFICANT TRAUMA W CC," 43,523 "
1070999 - UNC HOSPITALS,965,OTHER MULTIPLE SIGNIFICANT TRAUMA W-O CC-MCC," 26,183 "
1070999 - UNC HOSPITALS,969,HIV W EXTENSIVE O.R. PROCEDURE W MCC," 256,374 "
1070999 - UNC HOSPITALS,970,HIV W EXTENSIVE O.R. PROCEDURE W-O MCC," 67,531 "
1070999 - UNC HOSPITALS,974,HIV W MAJOR RELATED CONDITION W MCC," 95,667 "
1070999 - UNC HOSPITALS,975,HIV W MAJOR RELATED CONDITION W CC," 42,333 "
1070999 - UNC HOSPITALS,976,HIV W MAJOR RELATED CONDITION W-O CC-MCC," 24,730 "
1070999 - UNC HOSPITALS,977,HIV W OR W-O OTHER RELATED CONDITION," 22,232 "
1070999 - UNC HOSPITALS,981,EXTENSIVE O.R. PROCEDURE UNRELATED TO PRINCIPAL DIAGNOSIS W MCC," 227,775 "
1070999 - UNC HOSPITALS,982,EXTENSIVE O.R. PROCEDURE UNRELATED TO PRINCIPAL DIAGNOSIS W CC," 53,452 "
1070999 - UNC HOSPITALS,983,EXTENSIVE O.R. PROCEDURE UNRELATED TO PRINCIPAL DIAGNOSIS W-O CC-MCC," 42,341 "
1070999 - UNC HOSPITALS,987,NON-EXTENSIVE O.R. PROC UNRELATED TO PRINCIPAL DIAGNOSIS W MCC," 169,230 "
1070999 - UNC HOSPITALS,988,NON-EXTENSIVE O.R. PROC UNRELATED TO PRINCIPAL DIAGNOSIS W CC," 47,707 "
1070999 - UNC HOSPITALS,989,NON-EXTENSIVE O.R. PROC UNRELATED TO PRINCIPAL DIAGNOSIS W-O CC-MCC," 27,457 "
