UNC Hospitals,,,
1070999 - UNC HOSPITALS,410,BILIARY TRACT PROC EXCEPT ONLY CHOLECYST W OR W-O C.D.E. W-O CC-MCC," 53,558 "
1070999 - UNC HOSPITALS,414,CHOLECYSTECTOMY EXCEPT BY LAPAROSCOPE W-O C.D.E. W MCC," 78,763 "
1070999 - UNC HOSPITALS,415,CHOLECYSTECTOMY EXCEPT BY LAPAROSCOPE W-O C.D.E. W CC," 49,985 "
1070999 - UNC HOSPITALS,416,CHOLECYSTECTOMY EXCEPT BY LAPAROSCOPE W-O C.D.E. W-O CC-MCC," 27,872 "
1070999 - UNC HOSPITALS,417,LAPAROSCOPIC CHOLECYSTECTOMY W-O C.D.E. W MCC," 46,980 "
1070999 - UNC HOSPITALS,418,LAPAROSCOPIC CHOLECYSTECTOMY W-O C.D.E. W CC," 42,068 "
1070999 - UNC HOSPITALS,419,LAPAROSCOPIC CHOLECYSTECTOMY W-O C.D.E. W-O CC-MCC," 33,089 "
1070999 - UNC HOSPITALS,420,HEPATOBILIARY DIAGNOSTIC PROCEDURES W MCC," 130,757 "
1070999 - UNC HOSPITALS,421,HEPATOBILIARY DIAGNOSTIC PROCEDURES W CC," 49,115 "
1070999 - UNC HOSPITALS,422,HEPATOBILIARY DIAGNOSTIC PROCEDURES W-O CC-MCC," 36,622 "
1070999 - UNC HOSPITALS,423,OTHER HEPATOBILIARY OR PANCREAS O.R. PROCEDURES W MCC," 67,045 "
1070999 - UNC HOSPITALS,424,OTHER HEPATOBILIARY OR PANCREAS O.R. PROCEDURES W CC," 58,026 "
1070999 - UNC HOSPITALS,432,CIRRHOSIS AND ALCOHOLIC HEPATITIS W MCC," 63,950 "
1070999 - UNC HOSPITALS,433,CIRRHOSIS AND ALCOHOLIC HEPATITIS W CC," 28,488 "
1070999 - UNC HOSPITALS,434,CIRRHOSIS AND ALCOHOLIC HEPATITIS W-O CC-MCC," 19,966 "
1070999 - UNC HOSPITALS,435,MALIGNANCY OF HEPATOBILIARY SYSTEM OR PANCREAS W MCC," 39,035 "
1070999 - UNC HOSPITALS,436,MALIGNANCY OF HEPATOBILIARY SYSTEM OR PANCREAS W CC," 35,857 "
1070999 - UNC HOSPITALS,437,MALIGNANCY OF HEPATOBILIARY SYSTEM OR PANCREAS W-O CC-MCC," 22,204 "
1070999 - UNC HOSPITALS,438,DISORDERS OF PANCREAS EXCEPT MALIGNANCY W MCC," 47,450 "
1070999 - UNC HOSPITALS,439,DISORDERS OF PANCREAS EXCEPT MALIGNANCY W CC," 25,829 "
1070999 - UNC HOSPITALS,440,DISORDERS OF PANCREAS EXCEPT MALIGNANCY W-O CC-MCC," 18,109 "
1070999 - UNC HOSPITALS,441,DISORDERS OF LIVER EXCEPT MALIGCIRRALC HEPA W MCC," 57,784 "
1070999 - UNC HOSPITALS,442,DISORDERS OF LIVER EXCEPT MALIGCIRRALC HEPA W CC," 29,032 "
1070999 - UNC HOSPITALS,443,DISORDERS OF LIVER EXCEPT MALIGCIRRALC HEPA W-O CC-MCC," 18,711 "
1070999 - UNC HOSPITALS,444,DISORDERS OF THE BILIARY TRACT W MCC," 34,863 "
1070999 - UNC HOSPITALS,445,DISORDERS OF THE BILIARY TRACT W CC," 28,785 "
1070999 - UNC HOSPITALS,446,DISORDERS OF THE BILIARY TRACT W-O CC-MCC," 18,749 "
1070999 - UNC HOSPITALS,453,COMBINED ANTERIOR-POSTERIOR SPINAL FUSION W MCC," 298,247 "
1070999 - UNC HOSPITALS,454,COMBINED ANTERIOR-POSTERIOR SPINAL FUSION W CC," 175,101 "
1070999 - UNC HOSPITALS,455,COMBINED ANTERIOR-POSTERIOR SPINAL FUSION W-O CC-MCC," 111,340 "
1070999 - UNC HOSPITALS,456,SPINAL FUS EXC CERV W SPINAL CURV-MALIG-INFEC OR EXT FUS W MCC," 150,130 "
1070999 - UNC HOSPITALS,457,SPINAL FUS EXC CERV W SPINAL CURV-MALIG-INFEC OR EXT FUS W CC," 143,027 "
1070999 - UNC HOSPITALS,458,SPINAL FUS EXC CERV W SPINAL CURV-MALIG-INFEC OR EXT FUS W-O CC-MCC," 120,407 "
1070999 - UNC HOSPITALS,459,SPINAL FUSION EXCEPT CERVICAL W MCC," 158,080 "
1070999 - UNC HOSPITALS,460,SPINAL FUSION EXCEPT CERVICAL W-O MCC," 92,526 "
1070999 - UNC HOSPITALS,463,WND DEBRID AND SKN GRFT EXC HAND FOR MUSCULO-CONN TISS DIS W MCC," 128,411 "
1070999 - UNC HOSPITALS,464,WND DEBRID AND SKN GRFT EXC HAND FOR MUSCULO-CONN TISS DIS W CC," 68,742 "
1070999 - UNC HOSPITALS,465,WND DEBRID AND SKN GRFT EXC HAND FOR MUSCULO-CONN TISS DIS W-O CC-MCC," 44,426 "
1070999 - UNC HOSPITALS,466,REVISION OF HIP OR KNEE REPLACEMENT W MCC," 297,633 "
1070999 - UNC HOSPITALS,467,REVISION OF HIP OR KNEE REPLACEMENT W CC," 91,694 "
1070999 - UNC HOSPITALS,468,REVISION OF HIP OR KNEE REPLACEMENT W-O CC-MCC," 91,044 "
1070999 - UNC HOSPITALS,469,MAJOR HIP AND KNEE JOINT REPLACEMENT OR REATTACHMENT OF LOWER EXTREMITY W MCC OR TOTAL ANKLE REPLACEMENT," 76,747 "
1070999 - UNC HOSPITALS,470,MAJOR HIP AND KNEE JOINT REPLACEMENT OR REATTACHMENT OF LOWER EXTREMITY W-O MCC," 48,657 "
1070999 - UNC HOSPITALS,471,CERVICAL SPINAL FUSION W MCC," 82,168 "
1070999 - UNC HOSPITALS,472,CERVICAL SPINAL FUSION W CC," 73,069 "
1070999 - UNC HOSPITALS,473,CERVICAL SPINAL FUSION W-O CC-MCC," 63,963 "
1070999 - UNC HOSPITALS,474,AMPUTATION FOR MUSCULOSKELETAL SYS AND CONN TISSUE DIS W MCC," 63,713 "
1070999 - UNC HOSPITALS,475,AMPUTATION FOR MUSCULOSKELETAL SYS AND CONN TISSUE DIS W CC," 49,659 "
1070999 - UNC HOSPITALS,476,AMPUTATION FOR MUSCULOSKELETAL SYS AND CONN TISSUE DIS W-O CC-MCC," 33,274 "
1070999 - UNC HOSPITALS,477,BIOPSIES OF MUSCULOSKELETAL SYSTEM AND CONNECTIVE TISSUE W MCC," 93,605 "
1070999 - UNC HOSPITALS,478,BIOPSIES OF MUSCULOSKELETAL SYSTEM AND CONNECTIVE TISSUE W CC," 45,977 "
1070999 - UNC HOSPITALS,479,BIOPSIES OF MUSCULOSKELETAL SYSTEM AND CONNECTIVE TISSUE W-O CC-MCC," 36,004 "
1070999 - UNC HOSPITALS,480,HIP AND FEMUR PROCEDURES EXCEPT MAJOR JOINT W MCC," 81,290 "
1070999 - UNC HOSPITALS,481,HIP AND FEMUR PROCEDURES EXCEPT MAJOR JOINT W CC," 45,418 "
1070999 - UNC HOSPITALS,482,HIP AND FEMUR PROCEDURES EXCEPT MAJOR JOINT W-O CC-MCC," 37,151 "
1070999 - UNC HOSPITALS,483,MAJOR JOINT-LIMB REATTACHMENT PROCEDURE OF UPPER EXTREMITIES," 51,584 "
1070999 - UNC HOSPITALS,485,KNEE PROCEDURES W PDX OF INFECTION W MCC," 97,590 "
1070999 - UNC HOSPITALS,486,KNEE PROCEDURES W PDX OF INFECTION W CC," 49,745 "
1070999 - UNC HOSPITALS,487,KNEE PROCEDURES W PDX OF INFECTION W-O CC-MCC," 37,425 "
1070999 - UNC HOSPITALS,488,KNEE PROCEDURES W-O PDX OF INFECTION W CC-MCC," 70,854 "
1070999 - UNC HOSPITALS,489,KNEE PROCEDURES W-O PDX OF INFECTION W-O CC-MCC," 52,635 "
1070999 - UNC HOSPITALS,492,LOWER EXTREM AND HUMER PROC EXCEPT HIPFOOTFEMUR W MCC," 122,192 "
1070999 - UNC HOSPITALS,493,LOWER EXTREM AND HUMER PROC EXCEPT HIPFOOTFEMUR W CC," 56,911 "
1070999 - UNC HOSPITALS,494,LOWER EXTREM AND HUMER PROC EXCEPT HIPFOOTFEMUR W-O CC-MCC," 36,978 "
1070999 - UNC HOSPITALS,495,LOCAL EXCISION AND REMOVAL INT FIX DEVICES EXC HIP AND FEMUR W MCC," 100,491 "
1070999 - UNC HOSPITALS,496,LOCAL EXCISION AND REMOVAL INT FIX DEVICES EXC HIP AND FEMUR W CC," 43,446 "
1070999 - UNC HOSPITALS,497,LOCAL EXCISION AND REMOVAL INT FIX DEVICES EXC HIP AND FEMUR W-O CC-MCC," 34,480 "
1070999 - UNC HOSPITALS,498,LOCAL EXCISION AND REMOVAL INT FIX DEVICES OF HIP AND FEMUR W CC-MCC," 57,143 "
1070999 - UNC HOSPITALS,499,LOCAL EXCISION AND REMOVAL INT FIX DEVICES OF HIP AND FEMUR W-O CC-MCC," 36,216 "
1070999 - UNC HOSPITALS,500,SOFT TISSUE PROCEDURES W MCC," 106,800 "
1070999 - UNC HOSPITALS,501,SOFT TISSUE PROCEDURES W CC," 57,237 "
1070999 - UNC HOSPITALS,502,SOFT TISSUE PROCEDURES W-O CC-MCC," 35,104 "
1070999 - UNC HOSPITALS,503,FOOT PROCEDURES W MCC," 67,530 "
1070999 - UNC HOSPITALS,504,FOOT PROCEDURES W CC," 50,870 "
1070999 - UNC HOSPITALS,505,FOOT PROCEDURES W-O CC-MCC," 27,743 "
1070999 - UNC HOSPITALS,506,MAJOR THUMB OR JOINT PROCEDURES," 36,347 "
1070999 - UNC HOSPITALS,507,MAJOR SHOULDER OR ELBOW JOINT PROCEDURES W CC-MCC," 69,126 "
1070999 - UNC HOSPITALS,510,SHOULDERELBOW OR FOREARM PROCEXC MAJOR JOINT PROC W MCC," 97,417 "
1070999 - UNC HOSPITALS,511,SHOULDERELBOW OR FOREARM PROCEXC MAJOR JOINT PROC W CC," 44,444 "
1070999 - UNC HOSPITALS,512,SHOULDERELBOW OR FOREARM PROCEXC MAJOR JOINT PROC W-O CC-MCC," 45,666 "
1070999 - UNC HOSPITALS,513,HAND OR WRIST PROC EXCEPT MAJOR THUMB OR JOINT PROC W CC-MCC," 44,151 "
1070999 - UNC HOSPITALS,514,HAND OR WRIST PROC EXCEPT MAJOR THUMB OR JOINT PROC W-O CC-MCC," 30,345 "
1070999 - UNC HOSPITALS,515,OTHER MUSCULOSKELET SYS AND CONN TISS O.R. PROC W MCC," 187,289 "
1070999 - UNC HOSPITALS,516,OTHER MUSCULOSKELET SYS AND CONN TISS O.R. PROC W CC," 54,710 "
1070999 - UNC HOSPITALS,517,OTHER MUSCULOSKELET SYS AND CONN TISS O.R. PROC W-O CC-MCC," 39,594 "
1070999 - UNC HOSPITALS,518,BACK AND NECK PROC EXC SPINAL FUSION W MCC OR DISC DEVICE-NEUROSTIM," 90,809 "
1070999 - UNC HOSPITALS,519,BACK AND NECK PROC EXC SPINAL FUSION W CC," 62,997 "
1070999 - UNC HOSPITALS,520,BACK AND NECK PROC EXC SPINAL FUSION W-O CC-MCC," 69,111 "
1070999 - UNC HOSPITALS,533,FRACTURES OF FEMUR W MCC," 107,612 "
1070999 - UNC HOSPITALS,534,FRACTURES OF FEMUR W-O MCC," 11,789 "
1070999 - UNC HOSPITALS,535,FRACTURES OF HIP AND PELVIS W MCC," 26,862 "
1070999 - UNC HOSPITALS,536,FRACTURES OF HIP AND PELVIS W-O MCC," 21,103 "
1070999 - UNC HOSPITALS,537,SPRAINS STRAINS AND DISLOCATIONS OF HIP PELVIS AND THIGH W CC-MCC," 14,777 "
1070999 - UNC HOSPITALS,538,SPRAINS STRAINS AND DISLOCATIONS OF HIP PELVIS AND THIGH W-O CC-MCC," 7,963 "
1070999 - UNC HOSPITALS,539,OSTEOMYELITIS W MCC," 68,055 "
1070999 - UNC HOSPITALS,540,OSTEOMYELITIS W CC," 37,404 "
1070999 - UNC HOSPITALS,541,OSTEOMYELITIS W-O CC-MCC," 26,419 "
1070999 - UNC HOSPITALS,542,PATHOLOGICAL FRACTURES AND MUSCULOSKELET AND CONN TISS MALIG W MCC," 57,260 "
1070999 - UNC HOSPITALS,543,PATHOLOGICAL FRACTURES AND MUSCULOSKELET AND CONN TISS MALIG W CC," 42,842 "
1070999 - UNC HOSPITALS,544,PATHOLOGICAL FRACTURES AND MUSCULOSKELET AND CONN TISS MALIG W-O CC-MCC," 23,265 "
1070999 - UNC HOSPITALS,545,CONNECTIVE TISSUE DISORDERS W MCC," 69,055 "
1070999 - UNC HOSPITALS,546,CONNECTIVE TISSUE DISORDERS W CC," 40,662 "
1070999 - UNC HOSPITALS,547,CONNECTIVE TISSUE DISORDERS W-O CC-MCC," 42,618 "
1070999 - UNC HOSPITALS,548,SEPTIC ARTHRITIS W MCC," 56,885 "
1070999 - UNC HOSPITALS,549,SEPTIC ARTHRITIS W CC," 55,797 "
1070999 - UNC HOSPITALS,550,SEPTIC ARTHRITIS W-O CC-MCC," 15,520 "
1070999 - UNC HOSPITALS,551,MEDICAL BACK PROBLEMS W MCC," 69,885 "
1070999 - UNC HOSPITALS,552,MEDICAL BACK PROBLEMS W-O MCC," 27,952 "
1070999 - UNC HOSPITALS,553,BONE DISEASES AND ARTHROPATHIES W MCC," 497,928 "
1070999 - UNC HOSPITALS,554,BONE DISEASES AND ARTHROPATHIES W-O MCC," 25,133 "
1070999 - UNC HOSPITALS,555,SIGNS AND SYMPTOMS OF MUSCULOSKELETAL SYSTEM AND CONN TISSUE W MCC," 33,390 "
1070999 - UNC HOSPITALS,556,SIGNS AND SYMPTOMS OF MUSCULOSKELETAL SYSTEM AND CONN TISSUE W-O MCC," 24,967 "
1070999 - UNC HOSPITALS,557,TENDONITIS MYOSITIS AND BURSITIS W MCC," 44,546 "
1070999 - UNC HOSPITALS,558,TENDONITIS MYOSITIS AND BURSITIS W-O MCC," 26,426 "
1070999 - UNC HOSPITALS,559,AFTERCARE MUSCULOSKELETAL SYSTEM AND CONNECTIVE TISSUE W MCC," 75,113 "
1070999 - UNC HOSPITALS,560,AFTERCARE MUSCULOSKELETAL SYSTEM AND CONNECTIVE TISSUE W CC," 39,162 "
1070999 - UNC HOSPITALS,561,AFTERCARE MUSCULOSKELETAL SYSTEM AND CONNECTIVE TISSUE W-O CC-MCC," 29,908 "
1070999 - UNC HOSPITALS,562,FX SPRN STRN AND DISL EXCEPT FEMUR HIP PELVIS AND THIGH W MCC," 25,684 "
1070999 - UNC HOSPITALS,563,FX SPRN STRN AND DISL EXCEPT FEMUR HIP PELVIS AND THIGH W-O MCC," 22,401 "
1070999 - UNC HOSPITALS,564,OTHER MUSCULOSKELETAL SYS AND CONNECTIVE TISSUE DIAGNOSES W MCC," 39,166 "
1070999 - UNC HOSPITALS,565,OTHER MUSCULOSKELETAL SYS AND CONNECTIVE TISSUE DIAGNOSES W CC," 22,535 "
1070999 - UNC HOSPITALS,566,OTHER MUSCULOSKELETAL SYS AND CONNECTIVE TISSUE DIAGNOSES W-O CC-MCC," 19,819 "
1070999 - UNC HOSPITALS,570,SKIN DEBRIDEMENT W MCC," 98,671 "
1070999 - UNC HOSPITALS,571,SKIN DEBRIDEMENT W CC," 41,363 "
1070999 - UNC HOSPITALS,572,SKIN DEBRIDEMENT W-O CC-MCC," 28,872 "
1070999 - UNC HOSPITALS,573,SKIN GRAFT FOR SKIN ULCER OR CELLULITIS W MCC," 385,560 "
1070999 - UNC HOSPITALS,574,SKIN GRAFT FOR SKIN ULCER OR CELLULITIS W CC," 64,297 "
1070999 - UNC HOSPITALS,575,SKIN GRAFT FOR SKIN ULCER OR CELLULITIS W-O CC-MCC," 14,814 "
1070999 - UNC HOSPITALS,576,SKIN GRAFT EXC FOR SKIN ULCER OR CELLULITIS W MCC," 234,024 "
1070999 - UNC HOSPITALS,577,SKIN GRAFT EXC FOR SKIN ULCER OR CELLULITIS W CC," 75,266 "
1070999 - UNC HOSPITALS,578,SKIN GRAFT EXC FOR SKIN ULCER OR CELLULITIS W-O CC-MCC," 38,005 "
1070999 - UNC HOSPITALS,579,OTHER SKIN SUBCUT TISS AND BREAST PROC W MCC," 136,117 "
1070999 - UNC HOSPITALS,580,OTHER SKIN SUBCUT TISS AND BREAST PROC W CC," 33,120 "
1070999 - UNC HOSPITALS,581,OTHER SKIN SUBCUT TISS AND BREAST PROC W-O CC-MCC," 24,254 "
1070999 - UNC HOSPITALS,582,MASTECTOMY FOR MALIGNANCY W CC-MCC," 44,067 "
1070999 - UNC HOSPITALS,583,MASTECTOMY FOR MALIGNANCY W-O CC-MCC," 37,466 "
1070999 - UNC HOSPITALS,584,BREAST BIOPSY LOCAL EXCISION AND OTHER BREAST PROCEDURES W CC-MCC," 55,333 "
1070999 - UNC HOSPITALS,585,BREAST BIOPSY LOCAL EXCISION AND OTHER BREAST PROCEDURES W-O CC-MCC," 42,350 "
1070999 - UNC HOSPITALS,592,SKIN ULCERS W MCC," 27,892 "
1070999 - UNC HOSPITALS,593,SKIN ULCERS W CC," 19,030 "
1070999 - UNC HOSPITALS,595,MAJOR SKIN DISORDERS W MCC," 90,175 "
1070999 - UNC HOSPITALS,596,MAJOR SKIN DISORDERS W-O MCC," 27,369 "
1070999 - UNC HOSPITALS,597,MALIGNANT BREAST DISORDERS W MCC," 28,076 "
1070999 - UNC HOSPITALS,598,MALIGNANT BREAST DISORDERS W CC," 28,470 "
1070999 - UNC HOSPITALS,600,NON-MALIGNANT BREAST DISORDERS W CC-MCC," 37,034 "
1070999 - UNC HOSPITALS,601,NON-MALIGNANT BREAST DISORDERS W-O CC-MCC," 15,483 "
1070999 - UNC HOSPITALS,602,CELLULITIS W MCC," 34,122 "
1070999 - UNC HOSPITALS,603,CELLULITIS W-O MCC," 16,333 "
1070999 - UNC HOSPITALS,604,TRAUMA TO THE SKIN SUBCUT TISS AND BREAST W MCC," 113,001 "
1070999 - UNC HOSPITALS,605,TRAUMA TO THE SKIN SUBCUT TISS AND BREAST W-O MCC," 22,003 "
1070999 - UNC HOSPITALS,606,MINOR SKIN DISORDERS W MCC," 42,587 "
1070999 - UNC HOSPITALS,607,MINOR SKIN DISORDERS W-O MCC," 23,768 "
1070999 - UNC HOSPITALS,614,ADRENAL AND PITUITARY PROCEDURES W CC-MCC," 68,499 "
1070999 - UNC HOSPITALS,615,ADRENAL AND PITUITARY PROCEDURES W-O CC-MCC," 37,915 "
1070999 - UNC HOSPITALS,616,AMPUTAT OF LOWER LIMB FOR ENDOCRINENUTRITAND METABOL DIS W MCC," 72,155 "
1070999 - UNC HOSPITALS,617,AMPUTAT OF LOWER LIMB FOR ENDOCRINENUTRITAND METABOL DIS W CC," 46,284 "
1070999 - UNC HOSPITALS,619,O.R. PROCEDURES FOR OBESITY W MCC," 37,121 "
1070999 - UNC HOSPITALS,620,O.R. PROCEDURES FOR OBESITY W CC," 41,104 "
1070999 - UNC HOSPITALS,621,O.R. PROCEDURES FOR OBESITY W-O CC-MCC," 31,928 "
1070999 - UNC HOSPITALS,622,SKIN GRAFTS AND WOUND DEBRID FOR ENDOC NUTRIT AND METAB DIS W MCC," 52,212 "
1070999 - UNC HOSPITALS,623,SKIN GRAFTS AND WOUND DEBRID FOR ENDOC NUTRIT AND METAB DIS W CC," 45,298 "
1070999 - UNC HOSPITALS,624,SKIN GRAFTS AND WOUND DEBRID FOR ENDOC NUTRIT AND METAB DIS W-O CC-MCC," 14,773 "
1070999 - UNC HOSPITALS,625,THYROID PARATHYROID AND THYROGLOSSAL PROCEDURES W MCC," 48,151 "
1070999 - UNC HOSPITALS,626,THYROID PARATHYROID AND THYROGLOSSAL PROCEDURES W CC," 41,254 "
1070999 - UNC HOSPITALS,627,THYROID PARATHYROID AND THYROGLOSSAL PROCEDURES W-O CC-MCC," 26,414 "
1070999 - UNC HOSPITALS,628,OTHER ENDOCRINE NUTRIT AND METAB O.R. PROC W MCC," 173,780 "
1070999 - UNC HOSPITALS,629,OTHER ENDOCRINE NUTRIT AND METAB O.R. PROC W CC," 47,146 "
1070999 - UNC HOSPITALS,630,OTHER ENDOCRINE NUTRIT AND METAB O.R. PROC W-O CC-MCC," 27,792 "
1070999 - UNC HOSPITALS,637,DIABETES W MCC," 36,235 "
1070999 - UNC HOSPITALS,638,DIABETES W CC," 23,604 "
1070999 - UNC HOSPITALS,639,DIABETES W-O CC-MCC," 14,872 "
1070999 - UNC HOSPITALS,640,MISC DISORDERS OF NUTRITIONMETABOLISMFLUIDS-ELECTROLYTES W MCC," 32,616 "
1070999 - UNC HOSPITALS,641,MISC DISORDERS OF NUTRITIONMETABOLISMFLUIDS-ELECTROLYTES W-O MCC," 20,865 "
1070999 - UNC HOSPITALS,642,INBORN AND OTHER DISORDERS OF METABOLISM," 71,858 "
1070999 - UNC HOSPITALS,643,ENDOCRINE DISORDERS W MCC," 43,361 "
1070999 - UNC HOSPITALS,644,ENDOCRINE DISORDERS W CC," 23,150 "
1070999 - UNC HOSPITALS,645,ENDOCRINE DISORDERS W-O CC-MCC," 14,830 "
1070999 - UNC HOSPITALS,652,KIDNEY TRANSPLANT," 185,081 "
1070999 - UNC HOSPITALS,653,MAJOR BLADDER PROCEDURES W MCC," 126,899 "
1070999 - UNC HOSPITALS,654,MAJOR BLADDER PROCEDURES W CC," 58,652 "
1070999 - UNC HOSPITALS,655,MAJOR BLADDER PROCEDURES W-O CC-MCC," 47,688 "
1070999 - UNC HOSPITALS,656,KIDNEY AND URETER PROCEDURES FOR NEOPLASM W MCC," 84,416 "
1070999 - UNC HOSPITALS,657,KIDNEY AND URETER PROCEDURES FOR NEOPLASM W CC," 41,255 "
1070999 - UNC HOSPITALS,658,KIDNEY AND URETER PROCEDURES FOR NEOPLASM W-O CC-MCC," 29,724 "
1070999 - UNC HOSPITALS,659,KIDNEY AND URETER PROCEDURES FOR NON-NEOPLASM W MCC," 205,981 "
1070999 - UNC HOSPITALS,660,KIDNEY AND URETER PROCEDURES FOR NON-NEOPLASM W CC," 31,456 "
1070999 - UNC HOSPITALS,661,KIDNEY AND URETER PROCEDURES FOR NON-NEOPLASM W-O CC-MCC," 31,803 "
1070999 - UNC HOSPITALS,663,MINOR BLADDER PROCEDURES W CC," 23,919 "
1070999 - UNC HOSPITALS,664,MINOR BLADDER PROCEDURES W-O CC-MCC," 25,362 "
1070999 - UNC HOSPITALS,667,PROSTATECTOMY W-O CC-MCC," 14,872 "
1070999 - UNC HOSPITALS,668,TRANSURETHRAL PROCEDURES W MCC," 56,089 "
1070999 - UNC HOSPITALS,669,TRANSURETHRAL PROCEDURES W CC," 30,541 "
1070999 - UNC HOSPITALS,670,TRANSURETHRAL PROCEDURES W-O CC-MCC," 17,697 "
1070999 - UNC HOSPITALS,671,URETHRAL PROCEDURES W CC-MCC," 26,967 "
1070999 - UNC HOSPITALS,672,URETHRAL PROCEDURES W-O CC-MCC," 23,880 "
1070999 - UNC HOSPITALS,673,OTHER KIDNEY AND URINARY TRACT PROCEDURES W MCC," 116,771 "
1070999 - UNC HOSPITALS,674,OTHER KIDNEY AND URINARY TRACT PROCEDURES W CC," 49,201 "
1070999 - UNC HOSPITALS,675,OTHER KIDNEY AND URINARY TRACT PROCEDURES W-O CC-MCC," 29,479 "
1070999 - UNC HOSPITALS,682,RENAL FAILURE W MCC," 40,986 "
1070999 - UNC HOSPITALS,683,RENAL FAILURE W CC," 22,546 "
1070999 - UNC HOSPITALS,684,RENAL FAILURE W-O CC-MCC," 14,474 "
1070999 - UNC HOSPITALS,686,KIDNEY AND URINARY TRACT NEOPLASMS W MCC," 59,436 "
1070999 - UNC HOSPITALS,687,KIDNEY AND URINARY TRACT NEOPLASMS W CC," 24,889 "
1070999 - UNC HOSPITALS,689,KIDNEY AND URINARY TRACT INFECTIONS W MCC," 31,355 "
1070999 - UNC HOSPITALS,690,KIDNEY AND URINARY TRACT INFECTIONS W-O MCC," 18,175 "
1070999 - UNC HOSPITALS,693,URINARY STONES W-O ESW LITHOTRIPSY W MCC," 47,719 "
1070999 - UNC HOSPITALS,694,URINARY STONES W-O ESW LITHOTRIPSY W-O MCC," 23,166 "
1070999 - UNC HOSPITALS,695,KIDNEY AND URINARY TRACT SIGNS AND SYMPTOMS W MCC," 33,303 "
1070999 - UNC HOSPITALS,696,KIDNEY AND URINARY TRACT SIGNS AND SYMPTOMS W-O MCC," 14,193 "
1070999 - UNC HOSPITALS,697,URETHRAL STRICTURE," 18,899 "
1070999 - UNC HOSPITALS,698,OTHER KIDNEY AND URINARY TRACT DIAGNOSES W MCC," 42,985 "
1070999 - UNC HOSPITALS,699,OTHER KIDNEY AND URINARY TRACT DIAGNOSES W CC," 31,120 "
1070999 - UNC HOSPITALS,700,OTHER KIDNEY AND URINARY TRACT DIAGNOSES W-O CC-MCC," 26,328 "
1070999 - UNC HOSPITALS,707,MAJOR MALE PELVIC PROCEDURES W CC-MCC," 36,133 "
1070999 - UNC HOSPITALS,708,MAJOR MALE PELVIC PROCEDURES W-O CC-MCC," 28,916 "
1070999 - UNC HOSPITALS,709,PENIS PROCEDURES W CC-MCC," 39,285 "
1070999 - UNC HOSPITALS,710,PENIS PROCEDURES W-O CC-MCC," 22,901 "
1070999 - UNC HOSPITALS,711,TESTES PROCEDURES W CC-MCC," 31,850 "
1070999 - UNC HOSPITALS,712,TESTES PROCEDURES W-O CC-MCC," 18,832 "
1070999 - UNC HOSPITALS,713,TRANSURETHRAL PROSTATECTOMY W CC-MCC," 63,320 "
1070999 - UNC HOSPITALS,714,TRANSURETHRAL PROSTATECTOMY W-O CC-MCC," 13,118 "
1070999 - UNC HOSPITALS,715,OTHER MALE REPRODUCTIVE SYSTEM O.R. PROC FOR MALIGNANCY W CC-MCC," 144,191 "
1070999 - UNC HOSPITALS,716,OTHER MALE REPRODUCTIVE SYSTEM O.R. PROC FOR MALIGNANCY W-O CC-MCC," 24,525 "
1070999 - UNC HOSPITALS,717,OTHER MALE REPRODUCTIVE SYSTEM O.R. PROC EXC MALIGNANCY W CC-MCC," 31,317 "
1070999 - UNC HOSPITALS,718,OTHER MALE REPRODUCTIVE SYSTEM O.R. PROC EXC MALIGNANCY W-O CC-MCC," 28,545 "
1070999 - UNC HOSPITALS,722,MALIGNANCY MALE REPRODUCTIVE SYSTEM W MCC," 38,423 "
1070999 - UNC HOSPITALS,723,MALIGNANCY MALE REPRODUCTIVE SYSTEM W CC," 25,039 "
1070999 - UNC HOSPITALS,724,MALIGNANCY MALE REPRODUCTIVE SYSTEM W-O CC-MCC," 37,820 "
1070999 - UNC HOSPITALS,725,BENIGN PROSTATIC HYPERTROPHY W MCC," 22,694 "
1070999 - UNC HOSPITALS,727,INFLAMMATION OF THE MALE REPRODUCTIVE SYSTEM W MCC," 36,383 "
1070999 - UNC HOSPITALS,728,INFLAMMATION OF THE MALE REPRODUCTIVE SYSTEM W-O MCC," 26,043 "
1070999 - UNC HOSPITALS,729,OTHER MALE REPRODUCTIVE SYSTEM DIAGNOSES W CC-MCC," 14,229 "
1070999 - UNC HOSPITALS,730,OTHER MALE REPRODUCTIVE SYSTEM DIAGNOSES W-O CC-MCC," 14,189 "
1070999 - UNC HOSPITALS,734,PELVIC EVISCERATION RAD HYSTERECTOMY AND RAD VULVECTOMY W CC-MCC," 48,798 "
1070999 - UNC HOSPITALS,735,PELVIC EVISCERATION RAD HYSTERECTOMY AND RAD VULVECTOMY W-O CC-MCC," 29,697 "
1070999 - UNC HOSPITALS,736,UTERINE AND ADNEXA PROC FOR OVARIAN OR ADNEXAL MALIGNANCY W MCC," 93,647 "
1070999 - UNC HOSPITALS,737,UTERINE AND ADNEXA PROC FOR OVARIAN OR ADNEXAL MALIGNANCY W CC," 44,607 "
1070999 - UNC HOSPITALS,738,UTERINE AND ADNEXA PROC FOR OVARIAN OR ADNEXAL MALIGNANCY W-O CC-MCC," 30,578 "
1070999 - UNC HOSPITALS,739,UTERINEADNEXA PROC FOR NON-OVARIAN-ADNEXAL MALIG W MCC," 122,652 "
1070999 - UNC HOSPITALS,740,UTERINEADNEXA PROC FOR NON-OVARIAN-ADNEXAL MALIG W CC," 46,349 "
1070999 - UNC HOSPITALS,741,UTERINEADNEXA PROC FOR NON-OVARIAN-ADNEXAL MALIG W-O CC-MCC," 30,199 "
1070999 - UNC HOSPITALS,742,UTERINE AND ADNEXA PROC FOR NON-MALIGNANCY W CC-MCC," 37,376 "
1070999 - UNC HOSPITALS,743,UTERINE AND ADNEXA PROC FOR NON-MALIGNANCY W-O CC-MCC," 25,800 "
1070999 - UNC HOSPITALS,744,DANDC CONIZATION LAPAROSCOPY AND TUBAL INTERRUPTION W CC-MCC," 37,151 "
1070999 - UNC HOSPITALS,745,DANDC CONIZATION LAPAROSCOPY AND TUBAL INTERRUPTION W-O CC-MCC," 23,986 "
1070999 - UNC HOSPITALS,746,VAGINA CERVIX AND VULVA PROCEDURES W CC-MCC," 38,618 "
1070999 - UNC HOSPITALS,747,VAGINA CERVIX AND VULVA PROCEDURES W-O CC-MCC," 28,415 "
1070999 - UNC HOSPITALS,748,FEMALE REPRODUCTIVE SYSTEM RECONSTRUCTIVE PROCEDURES," 101,962 "
1070999 - UNC HOSPITALS,749,OTHER FEMALE REPRODUCTIVE SYSTEM O.R. PROCEDURES W CC-MCC," 56,996 "
1070999 - UNC HOSPITALS,750,OTHER FEMALE REPRODUCTIVE SYSTEM O.R. PROCEDURES W-O CC-MCC," 16,938 "
1070999 - UNC HOSPITALS,754,MALIGNANCY FEMALE REPRODUCTIVE SYSTEM W MCC," 49,744 "
1070999 - UNC HOSPITALS,755,MALIGNANCY FEMALE REPRODUCTIVE SYSTEM W CC," 31,924 "
1070999 - UNC HOSPITALS,756,MALIGNANCY FEMALE REPRODUCTIVE SYSTEM W-O CC-MCC," 18,674 "
1070999 - UNC HOSPITALS,757,INFECTIONS FEMALE REPRODUCTIVE SYSTEM W MCC," 18,163 "
1070999 - UNC HOSPITALS,758,INFECTIONS FEMALE REPRODUCTIVE SYSTEM W CC," 24,920 "
1070999 - UNC HOSPITALS,759,INFECTIONS FEMALE REPRODUCTIVE SYSTEM W-O CC-MCC," 18,214 "
1070999 - UNC HOSPITALS,760,MENSTRUAL AND OTHER FEMALE REPRODUCTIVE SYSTEM DISORDERS W CC-MCC," 25,780 "
1070999 - UNC HOSPITALS,761,MENSTRUAL AND OTHER FEMALE REPRODUCTIVE SYSTEM DISORDERS W-O CC-MCC," 9,846 "
1070999 - UNC HOSPITALS,765,CESAREAN SECTION W CC-MCC," 21,714 "
1070999 - UNC HOSPITALS,766,CESAREAN SECTION W-O CC-MCC," 15,222 "
1070999 - UNC HOSPITALS,767,VAGINAL DELIVERY W STERILIZATION AND-OR DANDC," 18,382 "
1070999 - UNC HOSPITALS,768,VAGINAL DELIVERY W O.R. PROC EXCEPT STERIL AND-OR DANDC," 26,800 "
1070999 - UNC HOSPITALS,769,POSTPARTUM AND POST ABORTION DIAGNOSES W O.R. PROCEDURE," 43,071 "
1070999 - UNC HOSPITALS,770,ABORTION W DANDC ASPIRATION CURETTAGE OR HYSTEROTOMY," 16,970 "
1070999 - UNC HOSPITALS,774,VAGINAL DELIVERY W COMPLICATING DIAGNOSES," 14,837 "
1070999 - UNC HOSPITALS,775,VAGINAL DELIVERY W-O COMPLICATING DIAGNOSES," 10,737 "
1070999 - UNC HOSPITALS,776,POSTPARTUM AND POST ABORTION DIAGNOSES W-O O.R. PROCEDURE," 17,565 "
1070999 - UNC HOSPITALS,777,ECTOPIC PREGNANCY," 24,857 "
1070999 - UNC HOSPITALS,778,THREATENED ABORTION," 10,529 "
1070999 - UNC HOSPITALS,779,ABORTION W-O DANDC," 14,869 "
1070999 - UNC HOSPITALS,780,FALSE LABOR," 11,085 "
1070999 - UNC HOSPITALS,781,OTHER ANTEPARTUM DIAGNOSES W MEDICAL COMPLICATIONS," 23,310 "
1070999 - UNC HOSPITALS,782,OTHER ANTEPARTUM DIAGNOSES W-O MEDICAL COMPLICATIONS," 11,236 "
1070999 - UNC HOSPITALS,789,NEONATES DIED OR TRANSFERRED TO ANOTHER ACUTE CARE FACILITY," 162,365 "
1070999 - UNC HOSPITALS,790,EXTREME IMMATURITY OR RESPIRATORY DISTRESS SYNDROME NEONATE," 461,944 "
1070999 - UNC HOSPITALS,791,PREMATURITY W MAJOR PROBLEMS," 98,458 "
1070999 - UNC HOSPITALS,792,PREMATURITY W-O MAJOR PROBLEMS," 30,956 "
1070999 - UNC HOSPITALS,793,FULL TERM NEONATE W MAJOR PROBLEMS," 53,591 "
1070999 - UNC HOSPITALS,794,NEONATE W OTHER SIGNIFICANT PROBLEMS," 5,153 "
1070999 - UNC HOSPITALS,795,NORMAL NEWBORN," 2,798 "
1070999 - UNC HOSPITALS,799,SPLENECTOMY W MCC," 56,924 "
1070999 - UNC HOSPITALS,800,SPLENECTOMY W CC," 54,211 "
1070999 - UNC HOSPITALS,801,SPLENECTOMY W-O CC-MCC," 27,301 "
1070999 - UNC HOSPITALS,802,OTHER O.R. PROC OF THE BLOOD AND BLOOD FORMING ORGANS W MCC," 102,579 "
1070999 - UNC HOSPITALS,803,OTHER O.R. PROC OF THE BLOOD AND BLOOD FORMING ORGANS W CC," 53,035 "
1070999 - UNC HOSPITALS,804,OTHER O.R. PROC OF THE BLOOD AND BLOOD FORMING ORGANS W-O CC-MCC," 71,583 "
1070999 - UNC HOSPITALS,808,MAJOR HEMATOL-IMMUN DIAG EXC SICKLE CELL CRISIS AND COAGUL W MCC," 48,580 "
1070999 - UNC HOSPITALS,809,MAJOR HEMATOL-IMMUN DIAG EXC SICKLE CELL CRISIS AND COAGUL W CC," 29,174 "
1070999 - UNC HOSPITALS,810,MAJOR HEMATOL-IMMUN DIAG EXC SICKLE CELL CRISIS AND COAGUL W-O CC-MCC," 66,098 "
1070999 - UNC HOSPITALS,811,RED BLOOD CELL DISORDERS W MCC," 64,033 "
1070999 - UNC HOSPITALS,812,RED BLOOD CELL DISORDERS W-O MCC," 19,589 "
1070999 - UNC HOSPITALS,813,COAGULATION DISORDERS," 152,530 "
1070999 - UNC HOSPITALS,814,RETICULOENDOTHELIAL AND IMMUNITY DISORDERS W MCC," 120,729 "
1070999 - UNC HOSPITALS,815,RETICULOENDOTHELIAL AND IMMUNITY DISORDERS W CC," 36,823 "
1070999 - UNC HOSPITALS,816,RETICULOENDOTHELIAL AND IMMUNITY DISORDERS W-O CC-MCC," 17,569 "
1070999 - UNC HOSPITALS,820,LYMPHOMA AND LEUKEMIA W MAJOR O.R. PROCEDURE W MCC," 236,799 "
1070999 - UNC HOSPITALS,821,LYMPHOMA AND LEUKEMIA W MAJOR O.R. PROCEDURE W CC," 61,713 "
1070999 - UNC HOSPITALS,822,LYMPHOMA AND LEUKEMIA W MAJOR O.R. PROCEDURE W-O CC-MCC," 33,168 "
1070999 - UNC HOSPITALS,823,LYMPHOMA AND NON-ACUTE LEUKEMIA W OTHER PROC W MCC," 230,849 "
1070999 - UNC HOSPITALS,824,LYMPHOMA AND NON-ACUTE LEUKEMIA W OTHER PROC W CC," 79,943 "
1070999 - UNC HOSPITALS,825,LYMPHOMA AND NON-ACUTE LEUKEMIA W OTHER PROC W-O CC-MCC," 51,453 "
